{
  "kicker": "혼합 상한 검증가나다라마바사아",
  "title": "표와 막대를 함께 세우는 상한가나다라마바사아자차",
  "stats": [
    {
      "value": "-9,999",
      "unit": "만건가",
      "label": "요약 지표 1가나다라마바사"
    },
    {
      "value": "123,45",
      "unit": "만건가",
      "label": "요약 지표 2가나다라마바사"
    },
    {
      "value": "9,999",
      "unit": "만건가",
      "label": "요약 지표 3가나다라마바사"
    }
  ],
  "table": {
    "columns": [
      {
        "label": "행 라벨 열 이름가"
      },
      {
        "label": "열2가나다라"
      },
      {
        "label": "열3가나다라"
      },
      {
        "label": "열4가나다라"
      }
    ],
    "rows": [
      {
        "label": "행 1 라벨가나다라마바사",
        "cells": [
          {
            "v": "값11가나다",
            "em": false
          },
          {
            "v": "값12가나다",
            "em": false
          },
          {
            "v": "값13가나다",
            "em": false
          }
        ]
      },
      {
        "label": "행 2 라벨가나다라마바사",
        "cells": [
          {
            "v": "값21가나다",
            "em": false
          },
          {
            "v": "값22가나다",
            "em": false
          },
          {
            "v": "값23가나다",
            "em": false
          }
        ]
      },
      {
        "label": "행 3 라벨가나다라마바사",
        "cells": [
          {
            "v": "값31가나다",
            "em": false
          },
          {
            "v": "값32가나다",
            "em": false
          },
          {
            "v": "값33가나다",
            "em": false
          }
        ]
      },
      {
        "label": "행 4 라벨가나다라마바사",
        "cells": [
          {
            "v": "값41가나다",
            "em": true
          },
          {
            "v": "값42가나다",
            "em": false
          },
          {
            "v": "값43가나다",
            "em": false
          }
        ]
      },
      {
        "label": "행 5 라벨가나다라마바사",
        "cells": [
          {
            "v": "값51가나다",
            "em": false
          },
          {
            "v": "값52가나다",
            "em": false
          },
          {
            "v": "값53가나다",
            "em": false
          }
        ]
      }
    ]
  },
  "chart": {
    "axisMax": 100,
    "bars": [
      {
        "label": "막대 1 라벨가나다라마바사아자차카",
        "value": 100,
        "display": "100%가나",
        "em": false
      },
      {
        "label": "막대 2 라벨가나다라마바사아자차카",
        "value": 82,
        "display": "82%가나다",
        "em": false
      },
      {
        "label": "막대 3 라벨가나다라마바사아자차카",
        "value": 61,
        "display": "61%가나다",
        "em": true
      },
      {
        "label": "막대 4 라벨가나다라마바사아자차카",
        "value": 34,
        "display": "34%가나다",
        "em": false
      }
    ]
  },
  "note": {
    "pre": "풋노트 앞 구간 상한 검증가나다라",
    "strong": "강조 상한가나다라마바사",
    "post": "풋노트 뒤 구간 상한가나다라마바사"
  },
  "frame": {
    "brand": "ReportArchive 브랜드가나다라마바사",
    "idx": "07",
    "total": "07"
  }
}
